tcpdump: verbose output suppressed, use -v or -vv for full protocol decode
listening on eth0, link-type EN10MB (Ethernet), capture size 262144 bytes
20:10:58.398974 IP 134.122.43.1.ssh > cpe5896307f4f64-cm5896307f4f62.cpe.net.cable.rogers.com.50626: Flags [P.], seq 729455002:729455110, ack 1825935884, win 501, length 108
20:10:58.399065 IP 134.122.43.1.ssh > cpe5896307f4f64-cm5896307f4f62.cpe.net.cable.rogers.com.50626: Flags [P.], seq 108:144, ack 1, win 501, length 36
20:10:58.399098 IP 134.122.43.1.ssh > cpe5896307f4f64-cm5896307f4f62.cpe.net.cable.rogers.com.50626: Flags [P.], seq 144:252, ack 1, win 501, length 108
20:10:58.399137 IP 134.122.43.1.ssh > cpe5896307f4f64-cm5896307f4f62.cpe.net.cable.rogers.com.50626: Flags [P.], seq 252:288, ack 1, win 501, length 36
20:10:58.399525 IP 134.122.43.1.43319 > dns.google.domain: 65379+ PTR? 151.231.112.174.in-addr.arpa. (46)
5 packets captured
22 packets received by filter
0 packets dropped by kernel
